{
  "contract_version": "1.0",
  "message_type": "response",
  "request_id": "req-document-status-demo",
  "status": "completed",
  "payload": {
    "binding_status": "bound",
    "revit_instance_id": "revit-4312",
    "document_title": "Area Assistant Development Copy",
    "document_path": "D:\\RevitTests\\area-assistant-development-copy.rvt",
    "document_fingerprint": "sha256:example-anonymous-fingerprint",
    "active_view": {"id": "12345", "name": "GFA Review"},
    "is_modified": false,
    "rvt_mcp_status": "verified",
    "write_allowed": true,
    "pause_reason": null
  }
}
